{
  "version": 1,
  "contract": "AuditLedger",
  "generated_at": "2026-09-27T05:00:00Z",
  "git_commit": "initial-baseline",
  "rust_toolchain": "stable",
  "variants": [
    {
      "ordinal": 0,
      "name": "Owner",
      "kind": "unit",
      "fields": [],
      "tombstone": false,
      "comment": ""
    },
    {
      "ordinal": 1,
      "name": "Config",
      "kind": "unit",
      "fields": [],
      "tombstone": false,
      "comment": ""
    },
    {
      "ordinal": 2,
      "name": "GlobalMaxLogs",
      "kind": "unit",
      "fields": [],
      "tombstone": true,
      "comment": "Replaced by Config — kept as tombstone variant so existing encoded keys don't collide; no longer written."
    },
    {
      "ordinal": 3,
      "name": "Paused",
      "kind": "unit",
      "fields": [],
      "tombstone": false,
      "comment": "Paused flag: when true, write operations are blocked."
    },
    {
      "ordinal": 4,
      "name": "SubmitterBlocklist",
      "kind": "tuple",
      "fields": [
        { "position": 0, "name": null, "type": "Address" }
      ],
      "tombstone": false,
      "comment": "Blocked submitters cannot submit events (issue #141)."
    },
    {
      "ordinal": 5,
      "name": "AllowlistMode",
      "kind": "unit",
      "fields": [],
      "tombstone": false,
      "comment": "If true, allowlist mode is enabled (issue #141)."
    },
    {
      "ordinal": 6,
      "name": "SubmitterAllowlist",
      "kind": "tuple",
      "fields": [
        { "position": 0, "name": null, "type": "Address" }
      ],
      "tombstone": false,
      "comment": "Per-submitter allowlist state (issue #141)."
    },
    {
      "ordinal": 7,
      "name": "TotalEvents",
      "kind": "unit",
      "fields": [],
      "tombstone": true,
      "comment": "Replaced by Config — kept as tombstone variant."
    },
    {
      "ordinal": 8,
      "name": "EventCapSet",
      "kind": "tuple",
      "fields": [
        { "position": 0, "name": null, "type": "Symbol" }
      ],
      "tombstone": true,
      "comment": "Replaced by EventCapConfig(Symbol) — kept as tombstone variant."
    },
    {
      "ordinal": 9,
      "name": "EventMaxLogs",
      "kind": "tuple",
      "fields": [
        { "position": 0, "name": null, "type": "Symbol" }
      ],
      "tombstone": true,
      "comment": "Replaced by EventCapConfig(Symbol) — kept as tombstone variant."
    },
    {
      "ordinal": 10,
      "name": "EventCapRemoved",
      "kind": "tuple",
      "fields": [
        { "position": 0, "name": null, "type": "Symbol" }
      ],
      "tombstone": false,
      "comment": ""
    },
    {
      "ordinal": 11,
      "name": "EventCapConfig",
      "kind": "tuple",
      "fields": [
        { "position": 0, "name": null, "type": "Symbol" }
      ],
      "tombstone": false,
      "comment": ""
    },
    {
      "ordinal": 12,
      "name": "EventTypeIndices",
      "kind": "tuple",
      "fields": [
        { "position": 0, "name": null, "type": "Symbol" }
      ],
      "tombstone": false,
      "comment": "Stores packed Bytes of u32 global-order indices (4 bytes each, LE) for a type (issue #54)."
    },
    {
      "ordinal": 13,
      "name": "SubmitterEventIndices",
      "kind": "tuple",
      "fields": [
        { "position": 0, "name": null, "type": "Address" }
      ],
      "tombstone": false,
      "comment": "Stores packed Bytes of u32 global-order indices (4 bytes each, LE) for a submitter (issue #206)."
    },
    {
      "ordinal": 14,
      "name": "SubmitterEventCount",
      "kind": "tuple",
      "fields": [
        { "position": 0, "name": null, "type": "Address" }
      ],
      "tombstone": false,
      "comment": "Cached event count per submitter (issue #206)."
    },
    {
      "ordinal": 15,
      "name": "EventData",
      "kind": "tuple",
      "fields": [
        { "position": 0, "name": null, "type": "BytesN<32>" }
      ],
      "tombstone": false,
      "comment": "Primary storage: event ID → Event."
    },
    {
      "ordinal": 16,
      "name": "EventOrder",
      "kind": "tuple",
      "fields": [
        { "position": 0, "name": null, "type": "u32" }
      ],
      "tombstone": false,
      "comment": "Sequential index → event ID, for ordered retrieval."
    },
    {
      "ordinal": 17,
      "name": "EventMetadataMaxSize",
      "kind": "tuple",
      "fields": [
        { "position": 0, "name": null, "type": "Symbol" }
      ],
      "tombstone": false,
      "comment": "Per-event-type metadata size cap (issue #67). Absent = use global default."
    },
    {
      "ordinal": 18,
      "name": "GlobalMetadataMaxSize",
      "kind": "unit",
      "fields": [],
      "tombstone": false,
      "comment": "Global metadata size cap (issue #67). Absent = DEFAULT_MAX_METADATA_SIZE."
    },
    {
      "ordinal": 19,
      "name": "MetadataSchema",
      "kind": "tuple",
      "fields": [
        { "position": 0, "name": null, "type": "Symbol" }
      ],
      "tombstone": false,
      "comment": "Per-event-type metadata validation schema (issue #202). Absent = no schema constraint."
    },
    {
      "ordinal": 20,
      "name": "EventSchema",
      "kind": "tuple",
      "fields": [
        { "position": 0, "name": null, "type": "Symbol" },
        { "position": 1, "name": null, "type": "u32" }
      ],
      "tombstone": false,
      "comment": "Versioned schema registry entry for a specific event type and schema version."
    },
    {
      "ordinal": 21,
      "name": "SchemaVersions",
      "kind": "tuple",
      "fields": [
        { "position": 0, "name": null, "type": "Symbol" }
      ],
      "tombstone": false,
      "comment": "Registered schema versions keyed by event type."
    },
    {
      "ordinal": 22,
      "name": "EventSchemaMigration",
      "kind": "tuple",
      "fields": [
        { "position": 0, "name": null, "type": "Symbol" },
        { "position": 1, "name": null, "type": "u32" },
        { "position": 2, "name": null, "type": "u32" }
      ],
      "tombstone": false,
      "comment": "Migration function for metadata updates between schema versions."
    },
    {
      "ordinal": 23,
      "name": "RuntimeState",
      "kind": "unit",
      "fields": [],
      "tombstone": false,
      "comment": "Cached full runtime state for fast reads."
    },
    {
      "ordinal": 24,
      "name": "EventSignature",
      "kind": "tuple",
      "fields": [
        { "position": 0, "name": null, "type": "BytesN<32>" }
      ],
      "tombstone": false,
      "comment": "Signature stored for an event (issue #69): (pubkey, signature)."
    },
    {
      "ordinal": 25,
      "name": "EventTypeCount",
      "kind": "tuple",
      "fields": [
        { "position": 0, "name": null, "type": "Symbol" }
      ],
      "tombstone": false,
      "comment": "Cached event count per type (issue #52). Updated alongside EventTypeIndices."
    },
    {
      "ordinal": 26,
      "name": "EventHeaderKey",
      "kind": "tuple",
      "fields": [
        { "position": 0, "name": null, "type": "BytesN<32>" }
      ],
      "tombstone": false,
      "comment": "Lightweight header (issue #56): EventHeader stored separately from metadata."
    },
    {
      "ordinal": 27,
      "name": "EventMeta",
      "kind": "tuple",
      "fields": [
        { "position": 0, "name": null, "type": "BytesN<32>" }
      ],
      "tombstone": false,
      "comment": "Optimized storage for event headers (issue #53): (index, timestamp, event_type, submitter)."
    },
    {
      "ordinal": 28,
      "name": "EventMetadata",
      "kind": "tuple",
      "fields": [
        { "position": 0, "name": null, "type": "BytesN<32>" }
      ],
      "tombstone": false,
      "comment": "Optimized storage for event metadata alone (issue #53)."
    },
    {
      "ordinal": 29,
      "name": "EventVersions",
      "kind": "tuple",
      "fields": [
        { "position": 0, "name": null, "type": "u32" }
      ],
      "tombstone": false,
      "comment": "Stored update history for events indexed by event order."
    },
    {
      "ordinal": 30,
      "name": "EventEmissionConfig",
      "kind": "unit",
      "fields": [],
      "tombstone": false,
      "comment": "Event emission configuration (issue #60): 0=full, 1=index-only, 2=hash-only, 3=none."
    },
    {
      "ordinal": 31,
      "name": "EventEmissionVersion",
      "kind": "unit",
      "fields": [],
      "tombstone": false,
      "comment": "Event emission version (issue #60): 1=full metadata, 2=index-only."
    },
    {
      "ordinal": 32,
      "name": "LowCostMode",
      "kind": "unit",
      "fields": [],
      "tombstone": false,
      "comment": "Low-cost mode configuration (issue #57): 0=normal, 1=low-cost."
    },
    {
      "ordinal": 33,
      "name": "SubmitterRateLimit",
      "kind": "tuple",
      "fields": [
        { "position": 0, "name": null, "type": "Address" }
      ],
      "tombstone": false,
      "comment": "Rate limit (max events per ledger timestamp) for a submitter (issue #62). 0 = blocked."
    },
    {
      "ordinal": 34,
      "name": "SubmitterRateState",
      "kind": "tuple",
      "fields": [
        { "position": 0, "name": null, "type": "Address" }
      ],
      "tombstone": false,
      "comment": "Rate-limit state (last_timestamp, count) per submitter (issue #62)."
    },
    {
      "ordinal": 35,
      "name": "SubmitterNonce",
      "kind": "tuple",
      "fields": [
        { "position": 0, "name": null, "type": "Address" }
      ],
      "tombstone": false,
      "comment": "Per-submitter nonce for replay-attack prevention (issue #64). Stores the last accepted nonce; absent means no event submitted yet (treat as 0)."
    },
    {
      "ordinal": 36,
      "name": "SubmitterNonceConfig",
      "kind": "tuple",
      "fields": [
        { "position": 0, "name": null, "type": "Address" }
      ],
      "tombstone": false,